Name,Type,SKU,Published,Visibility in catalog,Short description,Description,Regular price,Sale price,In stock?,Stock,Categories,Tags,Images
ЙОГА ЧАЙ /АЮРВЕДА/,simple,Код на продукта: КОД 22/865,1,visible,,"Йога чай е класически
сред аюрведическите сортове чай. В нашата смес ще намерите сушени листа от
коприва, в допълнение към класическите, пикантни съставки. Това е съживяваща
топла напитка в студените дни и е приятна за пиене по всяко време. Препоръчваме
класическото приготвяне или приготвяне на черен чай.

Класическо
приготвяне: Запарете 11 грама ""Йога чай"" в около 1 литър вода за
 30 минути, прецежда се и се добавя 1/4 л. прясно мляко. Така приготвеният
чай може да бъде подсладен с мед по желание.

Приготвяне с
черен чай: Запарете 11 гр ""Йога чай"" в около 1 литър вода за 30
минути. Добавете 6 грама черен чай и така приготвената смес да се запари в
продължение на още 3 - 5 минути. Прецежда се и се добавя мляко, по желание се
подслажда на вкус. 
Състав: канела, парченца джинджифил, карамфил, сушени листа от коприва, зърна
от бял пипер, семена от кардамон.Опаковака: насипен
чай",,,0,,"ЧАЙ, БЕЗ КОФЕИН, ЙОГА ЧАЙ /АЮРВЕДА/",,https://teashop.bg/image/cache/catalog/22865-600x600.gif
"БИЛКОВ ЧАЙ ""СВОБОДНО И ЛЕСНО"" /БИО ЧАЙ/",simple,Код на продукта: КОД 22/809,1,visible,,"Особено
специалният вкус на тази смес от билки в чай с многобройните цветни съставки,
обещава изключително удоволствие за сетивата. Избраните парченца плодове, както
и оригинални подправки, придават свежест и аромат на запарката. Сушените листа
от коприва и диви ягоди правят запарката със силно зелен цвят. Малко копър и
лъскавата кора от портокал допринасят за пролетно-свежия вкус. Лайка предлага
особена пикантна, но лека нотка, докато копъра дава своя сладникав вкус. Тъй
като няма добавени есенции, това творение ще ви очарова със своя натурален,
чист вкус.Състав: копър, цветове от лайка, портокалови кори, парченца ябълки, канела,
джинджифил, цветове от сребърна липа, сушени листа от коприва, листа от диви
ягоди, портокалов цвят, карамфил.



Опаковка: насипен
чай.",,,0,,"ЧАЙ, БЕЗ КОФЕИН, БИЛКОВ ЧАЙ ""СВОБОДНО И ЛЕСНО"" /БИО ЧАЙ/",,https://teashop.bg/image/cache/catalog/22809-600x600.gif
ПЛОДОВ ЧАЙ КОКОС - ЛАЙМ - АЛОЕ ВЕРА,simple,Код на продукта:  КОД 21/255,1,visible,,"Тропически плодов
и ярко жълт чай! Смес, излъчваща добро настроение, базирана на сладки плодови
парченца екзотичен жълт ананас и модерно, ярко бяло алое вера. Кокосовият
орех не иска да пропусне веселия плодов танц и се присъединява към танцуващата
тълпа ритмично с леко орехови, кремообразни движения. Живите нотки на лайм
допълват идеално сместа с приятна свежа нотка.Състав: кубчета
ананас, алое вера, портокалова кора, печени кокосови стърготини, кокосови
стърготини, шафран.(Поради недостига
на цветове от шафран и произтичащото от това ограничено предлагане,
количеството нашафранът може да
бъде намален и/или заменен с други съставки.)Тренд съставка:
алое вераОпаковака: насипен
чай",,,0,,"ЧАЙ, БЕЗ КОФЕИН, ПЛОДОВ ЧАЙ КОКОС - ЛАЙМ - АЛОЕ ВЕРА",,https://teashop.bg/image/cache/catalog/21255-600x600.jpg
ХИБИСКУС / КАРКАДЕ- НИГЕРИЯ- ORGANIC,simple,Код на продукта: КОД 22/910,1,visible,,"Чай от хибискус
се приготвя от сушени цветове на хибискус, който е растение с богато съдържание
на антоциани, флавоноиди, киселини и други полезни вещества. Този чай има
множество лечебни и полезни действия: Подобрява кръвообращението, помага за
контролиране на холестерола, при диабет. Подобрява имунната система: Хибискусът
е богат на витамин С, Uспокоява нервната система. Подобрява храносмилането.
Допринася за подмладяване на клетките. Тези са само някои от многото полезни
свойства на чая от хибискус.!!!ВАЖНО !!!
 Не е препоръчителен за бременни и кърмещи жени, като също така може да
има взаимодействия с някои лекарства, затова е добре да се консултирате с
лекар, преди да го използвате редовно.Приготвя се, като
за половин литър вряла вода се предвиждат около 5 гр. сухи листа Хибискус.
Кисне 10-15 мин., прецежда се и се подслажда по желание. Чаят от каркаде е
чудесен на вкус, с красив червен цвят, леко кисел и без никакъв кофеин.Опаковка: насипен
чай.",,,0,,"ЧАЙ, БЕЗ КОФЕИН, ХИБИСКУС / КАРКАДЕ- НИГЕРИЯ- ORGANIC",,https://teashop.bg/image/cache/catalog/22910-600x600.gif
РОЙБОС АКАЙ-ФЪСТЪЧЕНО МАСЛО,simple,Код на продукта: КОД 21/623,1,visible,,"Базирано на
популярното, греховно сладко лакомство с фъстъчено масло и желе от САЩ, това
творение е разработено от сладко фъстъчено масло и богати кремообразни
нотки. Черешката на тортата е суперплодът акай бери. Със своя уникален вкус
той балансира и завършва чудесно чашата чай.Състав:
чай Ройбос, парчета ябълка, парченца крем-карамел, кубчета акай (4%), листа от
сладка къпина, цвят от слез, лиофилизирано кисело мляко гранули
(обезмаслено кисело мляко, захар, малтодекстрин, модифицирано нишесте,
подкиселител: лимонена киселина).


Опаковака: насипен
чай",,,0,,"ЧАЙ, БЕЗ КОФЕИН, РОЙБОС АКАЙ-ФЪСТЪЧЕНО МАСЛО",,https://teashop.bg/image/cache/catalog/21623-600x600.jpg
"БИЛКОВ ЧАЙ ""КЛЕНОВ МЕД - ВАНИЛИЯ""",simple,Код на продукта: КОД 22/840,1,visible,,"Класическите билки и
подправки като копър, градински чай, лайка и анасон получават страхотен
визуален тласък тук от бялата, бухнала елда. Вкусът на тази смес е приятно
сладък и мек. Нотки на сладък мед, карамел и клен също радват небцето ви.Съдържание: копър, парчета ябълка, напукана елда, листа от
къпина, анасон, парченца канела, лайка, листа от градински чай, листа от сладка къпина.Тренд съставка: елдаОпаковка: насипен чай.",,,0,,"ЧАЙ, БЕЗ КОФЕИН, БИЛКОВ ЧАЙ ""КЛЕНОВ МЕД - ВАНИЛИЯ""",,https://teashop.bg/image/cache/catalog/21556-600x600.jpg
"БИЛКОВ ЧАЙ ""ФАМИЛИЯ""",simple,Код на продукта: КОД 22/840,1,visible,,"Това наистина е
чай за цялото семейство. Неговите тайни са множеството фини и много меки
съставки, които формират основата на този специалитет. Напитка, създадена за
малки и големи. Приятната сладост се получава от голямо количество парчета
ябълка, обогатен със свежа и ароматна мента. Листата на множество  храсти
и цветни, ярки цветове подобряват качеството на тази смес.Състав: парчета
ябълка, листа от мента, листа от малина, листа от къпина, цвят от слез, листа
от касис, котешка стъпка,
шафран.Без добавени
аромати!
(Поради недостига на цветове от шафран и произтичащото от това ограничено
предлагане, количеството шафран може да бъде намалено и/или заменено с други
съставки)







Опаковка: насипен
чай.",,,0,,"ЧАЙ, БЕЗ КОФЕИН, БИЛКОВ ЧАЙ ""ФАМИЛИЯ""",,https://teashop.bg/image/cache/catalog/22840-600x600.gif
"БИЛКОВ ЧАЙ ""ГРЕЙПФРУТ""",simple,Код на продукта: КОД 22/338,1,visible,,"Това меко
творение придава плодова сладост с парченцата ябълка и люспите от моркови и
нотка свежест от листата на евкалипт, лимонова трева, мандаринови късчета и нюанс
на хибискус. Парченцата цвекло придават своя цвят на чашата заедно с леко земна
нотка. Изсушените резенчета портокал и грейпфрут са оптично напомняне за свежия
цитрусов аромат на този абсолютно перфектен състав.Състав: ябълка,
морков, хибискус,грейпфрут, цвекло, лимонена трева, портокал, мандарина, листа
евкалипт, листа черна боровинка. 





Опаковка: насипен
чай.",,,0,,"ЧАЙ, БЕЗ КОФЕИН, БИЛКОВ ЧАЙ ""ГРЕЙПФРУТ""",,https://teashop.bg/image/cache/catalog/22338-600x600.gif
"ЗЕЛЕН РОЙБОС ""КРАЙ МОРЕТО""",simple,Код на продукта: КОД 21/272,1,visible,,"Понякога копнежът
просто ви подтиква ... към морско чувство: изключете се, оставете душата си да
мечтае, вдишайте свежест и се почувствайте красиви! Това е нашият стремеж с
нашето ново билково творение. Нека ви заведем до дюните на Северна Германия,
където зърнастецът грее на слънце. Насладете се на свежестта на мента и се
чувствайте красиви с алое вера и кокос и  с така модерната напоследък
куркума. Този чай е завършен от  мек ройбос и намек за водорасли хлорела.
Има ли нещо по -прекрасно от морския уелнес?Състав: чай
Ройбос, копър, кокос, Алое вера, лайка, мента, черна боровинка, морски
зърнастец, синя метличина, водорасли хорела, синя метличина, куркума./ без добавени
аромати/ Опаковка: насипен
чай.",,,0,,"ЧАЙ, БЕЗ КОФЕИН, ЗЕЛЕН РОЙБОС ""КРАЙ МОРЕТО""",,https://teashop.bg/image/cache/catalog/21272-600x600.jpg
"БИЛКОВ ЧАЙ ""РЕЙКИ"" /АЮРВЕДА/",simple,Код на продукта: КОД 22/117,1,visible,,"Терминът Рейки се
образува от японските думи Rej (космос) и Ki (духовна
енергия). Рейки е древен метод за духовно лечение. Твърди се, че тази
холистична терапия води до изцеление на физически, умствено, емоционално и
духовно ниво. Това чувство за благополучие е в основата на нашето най-ново
творение чай! Нашата добре балансирана смес от билки, плодове и цветове, е
чисто изживяване на природата- този път без никакви добавени аромати.Състав: ябълка,
лимонена трева, манго, шипка, портокал, кора морков, коприва, сладка черница,
царевична коса, слез, невен, роза листа и пъпки, парченца портокал и
морков. Опаковка: насипен
чай.",,,0,,"ЧАЙ, БЕЗ КОФЕИН, БИЛКОВ ЧАЙ ""РЕЙКИ"" /АЮРВЕДА/",,https://teashop.bg/image/cache/catalog/22117-600x600.gif
"БИЛКОВ ЧАЙ ""7 ЧАКРИ"" /АЮРВЕДА/",simple,Код на продукта: КОД 22/857,1,visible,,"Тази смес е хармонично
съставена по стари индийски рецепти. Интензивният, пикантен, цветен аромат и
вкус позволяват на всички съставки да се разкрият напълно. Особено леко
пикантният вкус на Мате е идеално допълнен от свежата нотка на лимонена трева.
Тази смес може да се пие както студена, така и топла и със сигурност прави
всеки период на гладуване по-лесен за понасяне.Състав: зелено
Мате, лимонена трева, шипка, джинджър, кардамон, черен пипер, босилек,
венчелистчета роза, римска лайка./ без добавени
аромати /Опаковка: насипен
чай.",,,0,,"ЧАЙ, БЕЗ КОФЕИН, БИЛКОВ ЧАЙ ""7 ЧАКРИ"" /АЮРВЕДА/",,https://teashop.bg/image/cache/catalog/22857-600x600.gif
БИЛКОВ ЧАЙ ЛЯТНО ЦВЕТЕ (без добавени аромати),simple,Код на продукта: КОД 21/596,1,visible,,"Лято без цветя е
като зима без сняг, помисли си една малка фея и създаде този прекрасен билков
чай. Малко мента за свежест, шепа джинджифил за подправка, захаросани кубчета
джинджифил и сладък корен за сладост - за всеки тип има по нещо. И цветна гама
от сияйни цветове, които да радват окото.Състав:
джинджифил на кубчета, ябълка на кубчета, шипка кора, корен от сладък корен,
листа маточина, мента, цвят от пирен, цвят от слез, метличина, алпийски
еделвайс, розови листенца. Опаковка- насипен
чай",,,0,,"ЧАЙ, БЕЗ КОФЕИН, БИЛКОВ ЧАЙ ЛЯТНО ЦВЕТЕ (без добавени аромати)",,https://teashop.bg/image/cache/catalog/21596-600x600.jpg
БИЛКОВ ЧАЙ -МУРСАЛСКИ ЧАЙ С ЦИТРУСИ,simple,Код на продукта: КОД 21/464,1,visible,,"Тучни зелени
алпийски ливади, покрити с жълти и виолетови цветове... това е, което ви идва
на ум, когато погледнете тази цветна комбинация. Тръпчиво- сладък грейпфрут и
цитрусови нотки се комбинират, за да създадат остро, свежо удоволствие. Сладки
листа от къпина и изобилие от джинджифил подобряват вкуса.Състав: ябълка,
върбинка, джинджифил, листа къпина, листа от малина, мурсалски чай (5%),
цветчета от слез и слънчоглед.Опаковка- насипен
чай",,,0,,"ЧАЙ, БЕЗ КОФЕИН, БИЛКОВ ЧАЙ -МУРСАЛСКИ ЧАЙ С ЦИТРУСИ",,https://teashop.bg/image/cache/catalog/21464-600x600.png
"БИЛКОВ ЧАЙ ""МАГИЧЕН АРОМАТ"" (без добавени аромати)",simple,Код на продукта: КОД  11/111,1,visible,,"Нашата ароматична
смес е не само красива за гледане с ефирните розови листа и мурсалски чай, но
също така носи охлаждащи и освежаващи нотки на мента и градински чай. Лайката
допълва идеално това визуално и ароматично изживяване.
Състав: мурсалски чай , градински чай, мента, лайка, розови листенца.

Опаковка- насипен
чай",,,0,,"ЧАЙ, БЕЗ КОФЕИН, БИЛКОВ ЧАЙ ""МАГИЧЕН АРОМАТ"" (без добавени аромати)",,https://teashop.bg/image/cache/catalog/11111-600x600.jpg
ЧЕРЕН ЧАЙ ПАНЕТОНЕ,simple,Код на продукта: КОД 21/690,1,visible,,"Панетоне е популярен италиански деликатес, който
се яде по Коледа. Вдъхновени от този десерт, разработихме чудесно творение чай с мека основа от черен чай, подсилена със стафиди и различни захаросани
плодове. Тази уникална чаена смес е завършена със сочни портокали, пикантни
нюанси на канела и сладки нотки, превръщайки всяка глътка във вкусно
изживяване. Това творение е идеалният избор за ценители, които искат да опитат
нещо ново и специално.Състав: черен чай, стафиди, ананас, кубчета
папая, портокалова кора, кубчета помело, резенчета портокал, листа от
къпина",,,0,,ЧЕРЕН ЧАЙ ПАНЕТОНЕ,,https://teashop.bg/image/cache/catalog/21690-600x600.jpg
ЗЕЛЕН ЧАЙ УЛОНГ SPICE NOTE,simple,Код на продукта: КОД 21/691,1,visible,,"Насладете се на сладката и уникална смес от чай улонг, съчетан със зимни подправки. Топлият аромат на канела и джинджифил изпълва сетивата ви и ви дава усещане за уют. Трябва да опитате този чай.Състав: полу-ферментирал чай Ti Kuan Yin, ананас, джинждифил, кардамом, куркума, канела

Опаковака: насипен
чай",,,0,,ЗЕЛЕН ЧАЙ УЛОНГ SPICE NOTE,,https://teashop.bg/image/cache/catalog/21691-600x600.jpg
КАФЕ СИНЯ СЛИВА И КАНЕЛА 100 % АРАБИКА,simple,Код на продукта: КОД 14/924,1,visible,,"Най-добрите планински
кафета от слънчева Южна Америка се комбинират в 
рецептата за торта със сливи на Granny за „студения сезон“. Резултатът:
удоволствие по всяко време на годината! Погалете сетивата си с
изкушаващия аромат на зрели сливи и пикантна канела. Аромат, който ще ви
напомни за сладкиша със сливи на баба ви. Наслаждавайте му се целогодишно, но
Комбинацията слива и  канела е вкусно
изживяване, особено в студените есенни и зимни дни.Съставки: Печено кафе
(100% Арабика), аромати.Опаковка: насипно кафе.*Ако желаете Вашето кафе
смляно, моля свържете се с нас!",,,0,,КАФЕ СИНЯ СЛИВА И КАНЕЛА 100 % АРАБИКА,,"https://teashop.bg/image/cache/catalog/14922--600x600.jpg, https://teashop.bg/image/cache/catalog/14924-600x600.jpg"
ЧЕРЕН ЧАЙ КАНЕЛА,simple,Код на продукта: КОД 22/413,1,visible,,"Класика от старо
време, която трябва да бъде част от всеки коледен асортимент. Смес от силен
черен чай ( Китай и Цейлон) , обогатена с цейлонска и мадагаскарска канела –
просто перфектно.


Опаковка: насипен чай.",,,0,,ЧЕРЕН ЧАЙ КАНЕЛА,,https://teashop.bg/image/cache/catalog/22413-600x600.jpg
ЗЕЛЕН ЧАЙ ПОРТОКАЛОВА БИСКВИТКА,simple,Код на продукта: КОД 22/035,1,visible,,"Това творение
въодушевява с вкуса си. Деликатни кремообразни вкусове на торта, съчетани със
свеж портокал и топли, зимни подправки като канела, кардамон
и кориандър ще ви накарат да копнеете за още...!

Състав: зелен чай
, парченца ябълка, парченца канела, кориандър, аромат, резени портокал,
кардамон, розов и черен пипер, карамфил.

Опаковка: насипен
чай",,,0,,ЗЕЛЕН ЧАЙ ПОРТОКАЛОВА БИСКВИТКА,,https://teashop.bg/image/cache/catalog/22035-600x600.jpg
КАФЕ РОМ И ШОКОЛАД 100 % АРАБИКА,simple,Код на продукта: КОД 13/644,1,visible,,"За тази класика е
подбрано зелено кафе от Колумбия и Бразилия. След зимна разходка на чист,
хладен въздух, едва ли има нещо, което ще ви сгрее по-добре от комбинацията от
шоколад и ром. Тази смес се състои предимно от фино, кремообразно какао и
допълва  с ром и сметана. Класиката
намира друг аспект на вкуса, обогатена от нотките на кафе - просто неотразимо!Състав: Печено кафе
(100% Арабика), аромати.Опаковка: насипно кафе.*Ако желаете Вашето кафе
смляно, моля свържете се с нас!",,,0,,КАФЕ РОМ И ШОКОЛАД 100 % АРАБИКА,,"https://teashop.bg/image/cache/catalog/13642--600x600.jpg, https://teashop.bg/image/cache/catalog/13644--600x600.jpg"
